{
  "schema_version": "1.0",
  "record_type": "CLAIM",
  "claim_id": "CL-003",
  "title": "Internal fidelity is not external predictive validity",
  "claim": "Rule coverage, traceability, reproducibility and textbook-case reconstruction can support internal formalization fidelity but cannot by themselves establish real-world predictive accuracy or causal validity.",
  "claim_domain": "PROJECT_METHOD",
  "evidence_basis": "PROJECT_ARTIFACT",
  "status": "ACTIVE",
  "source_status": "EXPLICIT",
  "implementation_status": "SPECIFIED",
  "internal_fidelity": "NOT_APPLICABLE",
  "empirical_status": "NOT_APPLICABLE",
  "causal_status": "NOT_APPLICABLE",
  "maturity_note": "This is a frozen methodological boundary in the project constitution and D-004/D-012.",
  "wording_ceiling": "Report internal and external evaluation separately; do not infer real-world accuracy or causality from source fidelity.",
  "evidence_refs": [
    {
      "label": "Project Constitution",
      "url": "https://github.com/15937-ass/ziwei-state-space/blob/main/PROJECT_CONSTITUTION.md",
      "authority_status": "ACCEPTED_MAIN",
      "repository_path": "PROJECT_CONSTITUTION.md",
      "blob_sha": "eadad9e01cd85fbf1bcee48240b7e688ffe7012c"
    },
    {
      "label": "Decision Log",
      "url": "https://github.com/15937-ass/ziwei-state-space/blob/main/DECISION_LOG.md",
      "authority_status": "ACCEPTED_MAIN",
      "repository_path": "DECISION_LOG.md",
      "blob_sha": "183423d9ec507625dc7eb344573ccbdfd75f0f9d"
    },
    {
      "label": "Paper 1 outline",
      "url": "https://github.com/15937-ass/ziwei-state-space/blob/main/paper/outline.md",
      "authority_status": "ACCEPTED_MAIN",
      "repository_path": "paper/outline.md",
      "blob_sha": "ece8b30328fe1e7b8a9c8ba37c13f516b7e325e7"
    },
    {
      "label": "Manuscript v0.1 snapshot",
      "url": "https://github.com/15937-ass/ziwei-state-space/blob/main/paper/manuscript_v0.1.md",
      "authority_status": "ACCEPTED_MAIN",
      "repository_path": "paper/manuscript_v0.1.md",
      "blob_sha": "281127cbaea3b84d23021092089cddf25eae1369",
      "note": "Working manuscript only; not independent evidence of its own quantitative statements."
    }
  ],
  "limitations": [
    "External predictive value requires held-out/appropriately blinded tests against baselines.",
    "Causal claims require separate identification assumptions and evidence."
  ],
  "last_updated": "2026-10-22",
  "supersedes": [],
  "superseded_by": []
}
